{
  "schema_version": "1.0",
  "primary_metric": "macro_f1",
  "minimum_primary_metric": 0.65,
  "minimum_accuracy": 0.75,
  "minimum_macro_f1": 0.65,
  "minimum_accuracy_ci_lower": 0.65,
  "minimum_macro_f1_ci_lower": 0.55,
  "minimum_per_class_recall": 0.5,
  "minimum_per_class_support": 20,
  "minimum_sessions": 10,
  "minimum_coverage_fraction": 0.9,
  "require_prospective": true,
  "require_one_time_lockbox": true
}
